{
  "contract_version": "3.0",
  "request_id": "req_fallback_0001",
  "capability": "search",
  "status": "ok",
  "results": [
    {
      "result_id": "res_1",
      "status": "ok",
      "title": "Served by fallback provider",
      "url": "https://example.net/x",
      "canonical_url": "https://example.net/x",
      "snippet": "Primary failed; fallback served this.",
      "cluster_id": "dc_1",
      "provenance": [
        {
          "provider": "brave",
          "source_url": "https://example.net/x",
          "retrieved_at": "2026-07-12T08:32:02Z",
          "provider_rank": 1
        }
      ]
    }
  ],
  "provider_attempts": [
    {
      "attempt_id": "att_1",
      "provider": "serper",
      "capability": "search",
      "outcome": "failed",
      "retry_count": 1,
      "result_count": 0,
      "started_at": "2026-07-12T08:32:00Z",
      "duration_ms": 1500,
      "budget_decision": "allowed",
      "circuit_state_before": "closed",
      "circuit_state_after": "open",
      "error": {
        "error_class": "transient",
        "code": "wsp.transient.upstream_5xx",
        "message": "Provider returned HTTP 503.",
        "retryable": true,
        "provider": "serper",
        "http_status": 503
      }
    },
    {
      "attempt_id": "att_2",
      "provider": "brave",
      "capability": "search",
      "outcome": "success",
      "retry_count": 0,
      "result_count": 1,
      "started_at": "2026-07-12T08:32:02Z",
      "duration_ms": 600,
      "budget_decision": "allowed",
      "circuit_state_before": "closed",
      "circuit_state_after": "closed"
    }
  ],
  "routing_receipt": {
    "policy_id": "classic",
    "policy_revision": "1",
    "mode": "classic",
    "candidate_order": ["serper", "brave"],
    "selected_provider": "brave",
    "fallback_reason": "selected_failed",
    "shadow": {
      "policy_id": "policy-core-v2",
      "policy_revision": "0.3.1",
      "proposed_order": ["brave", "serper"],
      "note": "observation only; not executed"
    }
  },
  "cache_status": { "disposition": "miss" },
  "limits_applied": { "max_results": 10 },
  "dedup_clusters": [
    { "cluster_id": "dc_1", "canonical_result_id": "res_1", "member_result_ids": ["res_1"], "providers": ["brave"] }
  ],
  "warnings": []
}
